	Ruan, J. L. et al. Mechanical Stress Conditioning and Electrical Stimulation Promote Contractility and Force Maturation of Induced Pluripotent Stem Cell-Derived Human Cardiac Tissue. Circulation 134, 1557–1567 (2016).	2016.0	 Mechanical Stress Conditioning and Electrical Stimulation Promote Contractility and Force Maturation of Induced Pluripotent Stem Cell-Derived Human Cardiac Tissue	 Circulation 134, 1557–1567 (2016)	https://doi.org/10.1161/CIRCULATIONAHA.114.014998		IBJ, IMR-90	2	NaN, Female	NaN, NaN	Matrigel	DMEM/F12, KOSR, NEAAs, sodium pyruvate, β-mercaptoethanol 	80	iCell Maintenance Medium (CDI)	B27	Activin A, BMP4, CHIR99021, bFGF	0-2	XAV939, IWP2	2-3				Flow cytometry for cTnT+	63		Matrigel				Yes	Yes	Yes					Collagen + Geltrex	CM + EC + SC	hiPSC-SMC	hiPSC-EC	58, 9, 15	RPMI-1640, B27	20.0	60	Yes						Force transducer 		1.0			0.037	60.0	127										PCR		
	Rupert, C. E., Irofuala, C. & Coulombe, K. L. K. Practical adoption of state-of-the-art hiPSC-cardiomyocyte differentiation techniques. PLoS One 15, (2020).	2020.0	 Practical adoption of state-of-the-art hiPSC-cardiomyocyte differentiation techniques	 PLoS One 15, (2020)	https://doi.org/10.1371/journal.pone.0230001		Gibco episomal, NCRM-5, WTC11	3	NaN, Male, Male	NaN, NaN, Asian	Vitronectin then Matrigel	E8		iCell Maintenance Medium (CDI)	B27	CHIR99021	0-1	IWP2	3-5	9, not 13-17	No glucose with lactate	13-17	Flow cytometry for cTnT+	82						Yes	Yes						Collagen	CM + SC	hCF		95, 0, 5	RPMI-1640, B27	1.0								Force transducer		0.18													Seahorse				
	Rupert, C. E., Kim, T. Y., Choi, B. R. & Coulombe, K. L. K. Human Cardiac Fibroblast Number and Activation State Modulate Electromechanical Function of hiPSC-Cardiomyocytes in Engineered Myocardium. Stem Cells Int 2020, (2020).	2020.0	Human Cardiac Fibroblast Number and Activation State Modulate Electromechanical Function of hiPSC-Cardiomyocytes in Engineered Myocardium	Stem Cells Int 2020, (2020)	https://doi.org/10.1155/2020/9363809		Gibco episomal	1			Vitronectin then Matrigel	E8	70	RPMI-1640	B27	CHIR99021	Not listed	IWP2	Not listed	7			Flow cytometry for cTnT+	52						Yes	Yes						Collagen	CM + SC	hCF		95, 0, 5	RPMI-1640, B27	16.0	10	Yes						Force transducer		0.15		Dye						Optical mapping				2.9			PCR		
	Saleem, U. et al. Blinded, Multicenter Evaluation of Drug-induced Changes in Contractility Using Human-induced Pluripotent Stem Cell-derived Cardiomyocytes. Toxicological Sciences 176, 103–123 (2020).	2020.0	 Blinded, Multicenter Evaluation of Drug-induced Changes in Contractility Using Human-induced Pluripotent Stem Cell-derived Cardiomyocytes	 Toxicological Sciences 176, 103–123 (2020)	https://doi.org/10.1093/toxsci/kfaa058		in-house, iCell2, Pluricyte	3	NaN, NaN, NaN	NaN, NaN, NaN				Pluricyte Cardiomyocyte Differentiation Kit (NCardia)		Activin A, BMP4, bFGF	0-3	DS-I-7	3-10	6						Matrigel				Yes							Fibrin + matrigel	CM			100, 0, 0	DMEM, galactose, sodium pyruvate, Pluricyte Cardiomyocyte Medium 	10.0	10							Post deflection				Dye						Optical mapping								epinephrine, forskolin, levosimendan, pimobendan, dobutamine, milrinone, omecamtiv mecarbil, terbutaline, verapamil, doxorubicin, sunitinib, citalopram, itraconazole, sorafenib, ivabradine, flecainide, phentolamine, zimelidine, atenolol, acetylsalicylic acid, captopril, glibenclamide, enalaprilat, clonidine, paracetamol, tolbutamide, pravastatin, sildenafil	
	Saleem, U. et al. Force and Calcium Transients Analysis in Human Engineered Heart Tissues Reveals Positive Force-Frequency Relation at Physiological Frequency. Stem Cell Reports 14, 312–324 (2020).	2020.0	 Force and Calcium Transients Analysis in Human Engineered Heart Tissues Reveals Positive Force-Frequency Relation at Physiological Frequency	 Stem Cell Reports 14, 312–324 (2020)	https://doi.org/10.1016/j.stemcr.2019.12.011		in-house	1			Geltrex	FTDA	EB	RPMI-1640	B27, HEPES, 1-thioglycerol	Activin A, BMP4, bFGF	0-3	DS-I-7	3-10	7, not 10-13	1-Thioglycerol	10-13	Flow cytometry for cTnT+							Yes							Fibrin	CM			100, 0, 0	DMEM, heat-inactivated horse serum, aprotinin, insulin	10.0	16	Yes						Post deflection	0.25			Genetically encoded sensor		83.0	190											isoproterenol, nifedipine, Bay K-8644, digoxin, EMD-57033, omecamtiv mecarbil	
	Saludas, L. et al. Long-term engraftment of human cardiomyocytes combined with biodegradable microparticles induces heart repair. Journal of Pharmacology and Experimental Therapeutics 370, 761–771 (2019).	2019.0	 Long-term engraftment of human cardiomyocytes combined with biodegradable microparticles induces heart repair	 Journal of Pharmacology and Experimental Therapeutics 370, 761–771 (2019)	https://doi.org/10.1124/jpet.118.256065		Gibco episomal	1			Matrigel	E8	85	RPMI-1640	B27	CHIR99021	0-1	WntC-59	3-5	7	No glucose with lactate	9-12	Flow cytometry for cTnT+	90										Biodegradable and biomimetic microparticles		ECM-coated microparticles									Yes																							PCR		
	Sapp, V. et al. Genome-wide CRISPR/Cas9 screening in human iPS derived cardiomyocytes uncovers novel mediators of doxorubicin cardiotoxicity. Sci Rep 11, (2021).	2021.0	 Genome-wide CRISPR/Cas9 screening in human iPS derived cardiomyocytes uncovers novel mediators of doxorubicin cardiotoxicity	 Sci Rep 11, (2021)	https://doi.org/10.1038/s41598-021-92988-1		IPSL1	1			Matrigel	E8 Flex		RPMI-1640	B27	CHIR99021	0-1	Wnt-C59	3-5	0	No glucose with lactate	15-25	Flow cytometry for cTnT+													ECM-coated plastic/glass																																RNA-seq, PCR	doxorubicin	
	Saraf, A. et al. Functional and molecular effects of TNF-α on human iPSC-derived cardiomyocytes. Stem Cell Res 52, (2021).	2021.0	 Functional and molecular effects of TNF-? on human iPSC-derived cardiomyocytes	 Stem Cell Res 52, (2021)	https://doi.org/10.1016/j.scr.2021.102218		SCVI-273, IMR-90	2	NaN, Female	NaN, NaN	Matrigel	KO-DMEM, KOSR, L-glutamine, NEAAs, bFGF, β-mercaptoethanol	85	RPMI-1640	B27	CHIR99021	0-2	IWR1	2-4	5			IHC for a-actinin	85		Matrigel										ECM-coated plastic/glass						RPMI-1640, B27			Yes						Motion tracking analysis				Dye													RNA-seq		
	Sasaki, D. et al. Contractile force measurement of human induced pluripotent stem cell-derived cardiac cell sheet-tissue. PLoS One 13, (2018).	2018.0	 Contractile force measurement of human induced pluripotent stem cell-derived cardiac cell sheet-tissue	 PLoS One 13, (2018)	https://doi.org/10.1371/journal.pone.0198026		201B7	1	Female	Caucasian	MEF feeder cells	Primate ES Cell Medium	EB	DMEM	FBS	Activin A, BMP4, bFGF	0-4	IWR1	4-6				Flow cytometry for cTnT+	95													Fibrin	CM			100, 0, 0			144	Yes						Force transducer	0.85	3.3																adrenaline	
	Schaefer, J. A., Guzman, P. A., Riemenschneider, S. B., Kamp, T. J. & Tranquillo, R. T. A cardiac patch from aligned microvessel and cardiomyocyte patches. J Tissue Eng Regen Med 12, 546–556 (2018).	2018.0	 A cardiac patch from aligned microvessel and cardiomyocyte patches	 J Tissue Eng Regen Med 12, 546–556 (2018)	https://doi.org/10.1002/term.2568		DF19-9-11T.H	1	Male		Matrigel	mTeSR-1		DMEM/F12	NEAAs, β-mercaptoethanol, FBS	CHIR99021	0-1	IWP2	3-5	7			Flow cytometry for cTnT+	85		FIbronectin					Yes		Yes				Fibrin	CM + EC + SC	hPC	BOEC	65, 29, 6	DMEM/F12, NEAAs, β-mercaptoethanol, FBS		5							Force transducer	1																		
	Schulz, A. et al. Tyramine-conjugated alginate hydrogels as a platform for bioactive scaffolds. J Biomed Mater Res A 107, 114–121 (2019).	2019.0	 Tyramine-conjugated alginate hydrogels as a platform for bioactive scaffolds	 J Biomed Mater Res A 107, 114–121 (2019)	https://doi.org/10.1002/jbm.a.36538		Cor.4U	1						Cor.4U complete medium												Matrigel							Yes	Yes		ECM-coated plastic/glass															Motion tracking analysis																			
	Schulze, M. L. et al. Dissecting hiPSC-CM pacemaker function in a cardiac organoid model. Biomaterials 206, 133–145 (2019).	2019.0	 Dissecting hiPSC-CM pacemaker function in a cardiac organoid model	 Biomaterials 206, 133–145 (2019)	https://doi.org/10.1016/j.biomaterials.2019.03.023		in-house	1					EB	RPMI-1640	B27	Activin A, BMP4, bFGF	0-3	DS-I-7	3-10	7, not 10-13	1-Thioglycerol	10-13	Flow cytometry for cTnT+	86													Scaffold free	CM			100, 0, 0			0.37	Yes										Dye						Patch clamp		90	-62.0				PCR	Ivabradine	
	Schwan, J. et al. Anisotropic engineered heart tissue made from laser-cut decellularized myocardium. Sci Rep 6, (2016).	2016.0	 Anisotropic engineered heart tissue made from laser-cut decellularized myocardium	 Sci Rep 6, (2016)	https://doi.org/10.1038/srep32068		in-house	1			Matrigel	mTeSR-1	90	RPMI-1640	B27	CHIR99021	0-1	IWP4	3-5							Fibronectin	Yes	IGF-1, dexamethasone, T3		Yes			Yes		Yes		Decellularized tissue	CM			100, 0, 0	RPMI-1640, B27, T3, dexamethasone 	10.0	2.5	Yes						Force transducer 	0.3	2.2		Dye			181											isoproterenol	
	Sebastião, M. J. et al. Bioreactor-based 3D human myocardial ischemia/reperfusion in vitro model: a novel tool to unveil key paracrine factors upon acute myocardial infarction. Translational Research 215, 57–74 (2020).	2020.0	 Bioreactor-based 3D human myocardial ischemia/reperfusion in vitro model: a novel tool to unveil key paracrine factors upon acute myocardial infarction	 Translational Research 215, 57–74 (2020)	https://doi.org/10.1016/j.trsl.2019.09.001		DF19-9-11T.H	1	Male		Matrigel	mTeSR-1	85	RPMI-1640	B27	CHIR99021, Activin A	0-1	IWR1	1-7	7			Flow cytometry for cTnT+	90	Pluricyte Medium		Yes	T3									Scaffold free	CM			100, 0, 0	Pluricyte Medium	0.13	0.03	Yes	TEM																								Acute myocardial infarction
	Shadrin, I. Y. et al. Cardiopatch platform enables maturation and scale-up of human pluripotent stem cell-derived engineered heart tissues. Nat Commun 8, (2017).	2017.0	 Cardiopatch platform enables maturation and scale-up of human pluripotent stem cell-derived engineered heart tissues	 Nat Commun 8, (2017)	https://doi.org/10.1038/s41467-017-01946-x		ATCC, BJ1	2	NaN, Male	NaN, NaN	Matrigel	TeSR-E8, mTeSR-1		RPMI-1640	B27	CHIR99021	0-1	IWP4	3-5	7, not 10-12	No glucose with lactate	10-12	Flow cytometry for cTnT+	86		Matrigel				Yes		Yes					Fibrin + matrigel	CM			100, 0, 0	RPMI-1460, B27, aminocaproic acid, L-ascorbic acid, 1-thioglycerol, NEAAs, sodium pyruvate	17.2	49-1681	Yes	TEM				Yes	Force transducer	20	22.4								Optical mapping	28.0						PCR		
	Shanmughapriya, S. et al. FOXD1-dependent MICU1 expression regulates mitochondrial activity and cell differentiation. Nat Commun 9, (2018).	2018.0	 FOXD1-dependent MICU1 expression regulates mitochondrial activity and cell differentiation	 Nat Commun 9, (2018)	https://doi.org/10.1038/s41467-018-05856-4		iPS-GM942-SeV3, iPS-GM942-SeV5	2	NaN, NaN	NaN, NaN	Geltrex	mTeSR-1, iPS-Brew XF		RPMI-1640	B27								Flow cytometry for cTnT+			Gelatin										ECM-coated plastic/glass						RPMI-1640, B27																								Seahorse	Yes			Mutations in MICU1
	Sharma, A. et al. High-throughput screening of tyrosine kinase inhibitor cardiotoxicity with human induced pluripotent stem cells. Sci Transl Med 9, (2017).	2017.0	 High-throughput screening of tyrosine kinase inhibitor cardiotoxicity with human induced pluripotent stem cells	 Sci Transl Med 9, (2017)	https://doi.org/10.1126/scitranslmed.aaf2584		in-house(2), iCell	11	NaN, NaN	NaN, NaN	Matrigel	E8	85	iCell Maintenance Medium (CDI)	iCell Maintenance Medium (CDI), glucose	CHIR99021	0-2	Wnt-C59	2-5		No glucose with lactate					Matrigel, Gelatin										ECM-coated plastic/glass									Yes						Motion tracking analysis										Patch clamp		90					RNA-seq	doxorubicin, dabrafenib, dasatinib, lapatinib, pazopanib, sorafenib, sunitinib, trametinib, nilotinib, crizotinib, vandetanib, vemurafenib	
	Shen, S. et al. Physiological calcium combined with electrical pacing accelerates maturation of human engineered heart tissue. Stem Cell Reports 17, 2037–2049 (2022).	2022.0	 Physiological calcium combined with electrical pacing accelerates maturation of human engineered heart tissue	 Stem Cell Reports 17, 2037–2049 (2022)	https://doi.org/10.1016/j.stemcr.2022.07.006	GSE201437	PGP1, in-house	2	Male, NaN	Caucasian, NaN	Matrigel	mTeSR-1		iCell Maintenance Medium (CDI)	B27	CHIR99021	0-1	IWP4	3-5	6, not 12-16	No glucose with lactate	12-16							Yes	Yes	Yes			Yes	Yes		Decellularized tissue	CM + SC	hCF		90, 0, 10	DMEM, FBS, NEAAs, L-glutamine, sodium-pyruvate	10.0	2.5							Force transducer	0.17		time to peak=0.29s	Dye		12.0											RNA-seq	isoproterenol	
	Shinnawi, R. et al. Monitoring human-induced pluripotent stem cell-derived cardiomyocytes with genetically encoded calcium and voltage fluorescent reporters. Stem Cell Reports 5, 582–596 (2015).	2015.0	 Monitoring human-induced pluripotent stem cell-derived cardiomyocytes with genetically encoded calcium and voltage fluorescent reporters	 Stem Cell Reports 5, 582–596 (2015)	https://doi.org/10.1016/j.stemcr.2015.08.009		TRDSi002-A-1	1	Male		Matrigel	mTeSR-1	85	iCell Maintenance Medium (CDI)	B27	CHIR99021	0-2	IWR1	3-5	11	No glucose	11-15	Flow cytometry for cTnI+	88		Matrigel										ECM-coated plastic/glass						RPMI-1640, B27			Yes										Genetically encoded sensor; Dye	3.0		250			Genetically encoded sensor; Optical mapping							PCR	cisapride, erythromycin, sotalol, nilotinib, oubain	ACM
	Silva, A. C. et al. Co-emergence of cardiac and gut tissues promotes cardiomyocyte maturation within human iPSC-derived organoids. Cell Stem Cell 28, 2137-2152.e6 (2021).	2021.0	 Co-emergence of cardiac and gut tissues promotes cardiomyocyte maturation within human iPSC-derived organoids	 Cell Stem Cell 28, 2137-2152.e6 (2021)	https://doi.org/10.1016/j.stem.2021.11.007		WTC11	1	Male 	Asian	Matrigel	mTeSR-1	100	iCell Maintenance Medium (CDI)	B27	CHIR99021	0-1	IWP2	3-5	7						Matrigel					Yes						Scaffold free		Mesendoderm progenitor cels 			RPMI-1640, B27		0.05	Yes	TEM	Yes	1.75	2000						Genetically encoded sensor 	2.2	54.0				Patch clamp		104	-66.0	4.0			RNA-seq		
	Smith, A. S. T. et al. NanoMEA: A Tool for High-Throughput, Electrophysiological Phenotyping of Patterned Excitable Cells. Nano Lett 20, 1561–1570 (2020).	2020.0	 NanoMEA: A Tool for High-Throughput, Electrophysiological Phenotyping of Patterned Excitable Cells	 Nano Lett 20, 1561–1570 (2020)	https://doi.org/10.1021/acs.nanolett.9b04152		iCell	1						iCell Maintenance Medium (CDI)	iCell Maintenance Medium (CDI)								IHC a-actinin	90		Gelatin							Yes			MEA									Yes			1.95							Dye			204			Patch clamp; MEA	26.0		-45.0					bepridil, cisapride, carbenoxolone, verapamil	
	Strimaityte, D. et al. Contractility and Calcium Transient Maturation in the Human iPSC-Derived Cardiac Microfibers. ACS Appl Mater Interfaces 14, 35376–35388 (2022).	2022.0	 Contractility and Calcium Transient Maturation in the Human iPSC-Derived Cardiac Microfibers	 ACS Appl Mater Interfaces 14, 35376–35388 (2022)	https://doi.org/10.1021/acsami.2c07326		in-house WTC	1			Matrigel	E8	85	iCell Maintenance Medium (CDI)	B27	CHIR99021	0-2	IWR1	3-5	7	No glucose	12-14	Flow cytometry for cTnT+	90									Yes	Yes		Micropatterned PAA						RPMI-1640, B27			Yes			1.9		Yes	Motion tracking analysis			6	Dye													PCR		HCM
	Strober, B. J. et al. Dynamic genetic regulation of gene expression during cellular differentiation.	2019.0	 Dynamic genetic regulation of gene expression during cellular differentiation		https://doi.org/10.1126/science.aaw0040		in-house	19			Matrigel	E8	85	iCell Maintenance Medium (CDI)	B27	CHIR99021	0-1	Wnt-C59	3-5				Flow cytometry for cTnT+	40.4												ECM-coated plastic/glass									Yes		Yes																					RNA-seq		
	Sun, S. et al. Progressive Myofibril Reorganization of Human Cardiomyocytes on a Dynamic Nanotopographic Substrate. ACS Appl Mater Interfaces 12, 21450–21462 (2020).	2020.0	 Progressive Myofibril Reorganization of Human Cardiomyocytes on a Dynamic Nanotopographic Substrate	 ACS Appl Mater Interfaces 12, 21450–21462 (2020)	https://doi.org/10.1021/acsami.0c03464		WTC11	1	Male 	Asian	Geltrex	E8	100	iCell Maintenance Medium (CDI)	B27	CHIR99021	0-2	IWP4	2-4	6, not 22-28	No glucose with lactate	22-28				Geltrex							Yes	Yes		Nanotopography (Shape memory polymers (SMP) Poly(tBA-co-BA) PEM coated with wrinkles)						RPMI-1640, B27			Yes	SEM	Yes	2.0	1500		Motion tracking analysis			1.2															blebbistatin	
	Sung, T. C. et al. Transient characteristics of universal cells on human-induced pluripotent stem cells and their differentiated cells derived from foetal stem cells with mixed donor sources. Cell Prolif 54, (2021).	2021.0	 Transient characteristics of universal cells on human-induced pluripotent stem cells and their differentiated cells derived from foetal stem cells with mixed donor sources	 Cell Prolif 54, (2021)	https://doi.org/10.1158/0008-5472.CAN-24-0642		454E2, in-house (3)	4	NaN, NaN	NaN, NaN	Vitronectin	E8	85	iCell Maintenance Medium (CDI)	B27	CHIR99021	0-2	IWR1	4-6	7																ECM-coated plastic/glass									Yes																									
	Takada, T. et al. Aligned human induced pluripotent stem cell-derived cardiac tissue improves contractile properties through promoting unidirectional and synchronous cardiomyocyte contraction. Biomaterials 281, (2022).	2022.0	 Aligned human induced pluripotent stem cell-derived cardiac tissue improves contractile properties through promoting unidirectional and synchronous cardiomyocyte contraction	 Biomaterials 281, (2022)	https://doi.org/10.1016/j.biomaterials.2021.121351		201B7	1	Female	Caucasian	MEF feeder cells	Primate ES Cell Medium	EB	DMEM	FBS	Activin A, BMP4, bFGF	0-4	IWR1	4-6		Puromycin		Flow cytometry for cTnT+	89									Yes			Microgrooves						DMEM, FBS			Yes		Yes				Motion tracking analysis, force transducer	0.9														Metabolic flux		PCR	isoproterenol	
	Takeda, M. et al. Development of in vitro drug-induced cardiotoxicity assay by using three-dimensional cardiac tissues derived from human induced pluripotent stem cells. Tissue Eng Part C Methods 24, 56–67 (2018).	2018.0	 Development of in vitro drug-induced cardiotoxicity assay by using three-dimensional cardiac tissues derived from human induced pluripotent stem cells	 Tissue Eng Part C Methods 24, 56–67 (2018)	https://doi.org/10.1016/j.biomaterials.2021.121351		253G1	1			MEF feeder cells	Primate ES Cell medium		DMEM	FBS	Activin A, BMP4, bFGF	0-4	IWR1	4-6																		Fibronectin/gelatin nano films	CM			100, 0, 0	DMEM, FBS	0.5		Yes						Motion tracking analysis				Dye						MEA							PCR	E4031, isoproterenol	
	Tamargo, M. A. et al. MilliPillar: A Platform for the Generation and Real-Time Assessment of Human Engineered Cardiac Tissues. ACS Biomater Sci Eng 7, 5215–5229 (2021).	2021.0	 MilliPillar: A Platform for the Generation and Real-Time Assessment of Human Engineered Cardiac Tissues	 ACS Biomater Sci Eng 7, 5215–5229 (2021)	https://doi.org/10.1021/acsbiomaterials.1c01006		WTC11, BS2	2	Male, NaN	Asian, NaN	Synthemax II-SC, Matrigel	E8	85	RPMI-1640	B27, L-ascorbic acid	CHIR99021	0-2	Wnt-C59	2-4	10	No glucose	10-13	Flow cytometry for cTnT+	85					Yes	Yes	Yes						Fibrin or collagen	CM + SC	hCF;hDF		75, 0, 25	RPMI-1640, B27, L-ascorbic acid	37.0	2	Yes		Yes				Post deflection		3.22	622	Genetically encoded sensor	0.18		210							2.7					
	Tan, Y. et al. Cell number per spheroid and electrical conductivity of nanowires influence the function of silicon nanowired human cardiac spheroids. Acta Biomater 51, 495–504 (2017).	2017.0	 Cell number per spheroid and electrical conductivity of nanowires influence the function of silicon nanowired human cardiac spheroids	 Acta Biomater 51, 495–504 (2017)	https://doi.org/10.1016/j.actbio.2017.01.029		iCell	1						iCell Maintenance Medium (CDI)	iCell Maintenance Medium (CDI)											Gelatin										ECM-coated plastic/glass	Scaffold free	CM			100, 0, 0	iCell Maintenance Medium (CDI)	0.21	0.03	Yes	TEM										2.2										OCR chamber equipped with fiber optic sensors				
	Tan, Y. et al. Silicon nanowire-induced maturation of cardiomyocytes derived from human induced pluripotent stem cells. Nano Lett 15, 2765–2772 (2015).	2015.0	 Silicon nanowire-induced maturation of cardiomyocytes derived from human induced pluripotent stem cells	 Nano Lett 15, 2765–2772 (2015)	https://doi.org/10.1021/nl502227a		iCell	1						iCell Maintenance Medium (CDI)	iCell Maintenance Medium (CDI)											Gelatin											Scaffold free	CM + NRCM			100, 0, 0	iCell Maintenance Medium (CDI)	3.0	0.09	Yes	TEM	Yes	1.8							Dye	1.5		800										PCR		
	Tang, Y. et al. Induction and differentiation of human induced pluripotent stem cells into functional cardiomyocytes on a compartmented monolayer of gelatin nanofibers. Nanoscale 8, 14530–14540 (2016).	2016.0	 Induction and differentiation of human induced pluripotent stem cells into functional cardiomyocytes on a compartmented monolayer of gelatin nanofibers	 Nanoscale 8, 14530–14540 (2016)	https://doi.org/10.1039/c6nr04545f		253G1	1			Vitronectin	E8		iCell Maintenance Medium (CDI)	B27	CHIR99021	0-1	IWP2	3-5	8			Flow cytometry for cTnT+	75									Yes			Electrospun fibers									Yes												108.0				MEA							PCR	E-4031, isoproterenol, propranolol	
	Thavandiran, N. et al. Functional arrays of human pluripotent stem cell-derived cardiac microtissues. Sci Rep 10, (2020).	2020.0	 Functional arrays of human pluripotent stem cell-derived cardiac microtissues	 Sci Rep 10, (2020)	https://doi.org/10.1038/s41598-020-62955-3		iPSCTF	1			Matrigel	HES2 maintenance media, mTeSR-1	90	iCell Maintenance Medium (CDI)	B27, GlutaMax, HEPES	CHIR99021	0-1	IWP2 and proprietary tankyrase inhibitor	3-5	5			Flow cytometry for cTnT+			Synthemax II-SC				Yes	Yes						Collagen	CM + SC	hCF		100, 0, 10	RPMI-1640, B27, HEPES, GlutaMax		2	Yes						Post deflection																		blebbistatin, isoproterenol, nifedipine	
	Thomas, T. et al. Extrusion 3D Printing of Porous Silicone Architectures for Engineering Human Cardiomyocyte-Infused Patches Mimicking Adult Heart Stiffness. ACS Appl Bio Mater 3, 5865–5871 (2020).	2020.0	 Extrusion 3D Printing of Porous Silicone Architectures for Engineering Human Cardiomyocyte-Infused Patches Mimicking Adult Heart Stiffness	 ACS Appl Bio Mater 3, 5865–5871 (2020)	https://doi.org/10.1021/acsabm.0c00572		PGP1	1	Male	Caucasian	Matrigel	mTeSR-1	85	iCell Maintenance Medium (CDI)	B27	CHIR99021	0-3	IWP4	3-4	9			Not listed	90									Yes				3D printed silicone macroporous silicone scaffold	CM			100, 0, 0	RPMI-1640, B27, FBS		100	Yes																									
	Tiburcy, M. et al. Defined engineered human myocardium with advanced maturation for applications in heart failure modeling and repair. Circulation 135, 1832–1847 (2017).	2017.0	 Defined engineered human myocardium with advanced maturation for applications in heart failure modeling and repair	 Circulation 135, 1832–1847 (2017)	https://doi.org/10.1161/CIRCULATIONAHA.116.024145		BJ1, hiPS-G1	2	Male, NaN	NaN, NaN	Matrigel	mTeSR-E8 or KO-DMEM, KOSR, L-glutamine, NEAAs, human foreskin fibroblast conditioned media, bFGF		iCell Maintenance Medium (CDI)	B27, L-ascorbic acid	Activin A, BMP4, CHIR99021, bFGF	0-3	IWP4	4-13	17	No glucose and lactate	13-17	Flow cytometry for a-actinin+	94						Yes	Yes						Collagen + matrigel	CM + SC	hCF		70, 0, 30	Isocove medium, B27, IGF-1, bFGF, VEGF, TGFB1, NEAAs, L-glutamine	30.0	1	Yes	EM		1.95			Post deflection	1.3	6.0								Patch clamp		97	-57.0				RNA-seq	isoproterenol, carbachol, CGP-20712A, CI-118551	Simulation of Heart Failure in EHM by Neurohumoral Overstimulation
	Toepfer, C. N. et al. Myosin Sequestration Regulates Sarcomere Function, Cardiomyocyte Energetics, and Metabolism, Informing the Pathogenesis of Hypertrophic Cardiomyopathy. Circulation 828–842 (2020). 	2020.0	 Myosin Sequestration Regulates Sarcomere Function, Cardiomyocyte Energetics, and Metabolism, Informing the Pathogenesis of Hypertrophic Cardiomyopathy	 Circulation 828–842 (2020)	https://doi.org/10.1161/CIRCULATIONAHA.119.042339		PGP1	1	Male	Caucasian	Matrigel	mTeSR-1	90	iCell Maintenance Medium (CDI)	B27	CHIR99021	0-1	Wnt-C59	3-5	7	No glucose	9-11				Matrigel										ECM-coated plastic/glass									Yes				2000																	Seahorse	Yes			HCM
	Toepfer, C. N. et al. SarcTrack. Circ Res 124, 1172–1183 (2019).	2019.0	 SarcTrack	 Circ Res 124, 1172–1183 (2019)	https://doi.org/10.1161/CIRCRESAHA.118.31450		PGP1	1	Male	Caucasian	Matrigel	mTeSR-1		iCell Maintenance Medium (CDI)	B27	CHIR99021	0-1	IWP4	3-5	7	No glucose with lactate	10-12				Matrigel										ECM-coated plastic/glass									Yes			1.93			Motion tracking analysis; TFM						40.0												MYK-461, CK-1827452, verapamil, propanolol	HCM
	Tomov, M. L. et al. Distinct and Shared Determinants of Cardiomyocyte Contractility in Multi-Lineage Competent Ethnically Diverse Human iPSCs. Sci Rep 6, (2016).	2016.0	 Distinct and Shared Determinants of Cardiomyocyte Contractility in Multi-Lineage Competent Ethnically Diverse Human iPSCs	 Sci Rep 6, (2016)	https://doi.org/10.1038/srep37637		in-house	1			StemAdhere	mTeSR2, TeSR-E8		iCell Maintenance Medium (CDI)	B27	CHIR99021	0-1	IWP2	3-5														Yes			Micropatterned PDMS									Yes																							RNA-seq		
	Treat, J. A., Goodrow, R. J., Bot, C. T., Haedo, R. J. & Cordeiro, J. M. Pharmacological enhancement of repolarization reserve in human induced pluripotent stem cells derived cardiomyocytes. Biochem Pharmacol 169, (2019).	2019.0	 Pharmacological enhancement of repolarization reserve in human induced pluripotent stem cells derived cardiomyocytes	 Biochem Pharmacol 169, (2019)	https://doi.org/10.1016/j.bcp.2019.08.010		WiCell	1			Matrigel	E8		RPMI-1640	B27, T3, dexamethasone	CHIR99021	0-2	IWP2, KY0211	2-6	8	No glucose with lactate	12-14				Matrigel										MEA																									MEA		100					PCR	NS3623, E4031	
